{
  "$schema": "http://json-schema.org/draft-07/schema#",
  "title": "Achievement",
  "type": "object",
  "required": ["id", "name", "description", "type", "icon"],
  "properties": {
    "id": { "type": "integer" },
    "name": { "type": "string" },
    "description": { "type": "string" },
    "type": { "type": "string" },
    "icon": { "type": "string" }
  }
}